Image Name,Scan Type(s),Scan Description,Bottom Line,Source URL
image0648.png,"MRI, MR","awv235-F2: MRI findings in a 46-year-old male patient with iatrogenic CJD due to growth hormone. Basal ganglia and thalamic hyperintensity is seen on T2-weighted images (A), DWI at b = 1000s/mm2 (B) and (C) DWI at b = 3000s/mm2. Cortical hyperintensity in the paracentral lobule bilaterally and right precentral gyrus is not visualized on T2-weighted images (D) but is seen on DWI b = 1000s/mm2 (E) and (F) is more conspicuous at DWI at b = 3000s/mm2 (Patient 12).","Bottom Line:The electroencephalogram was abnormal in 15 patients and cerebrospinal fluid 14-3-3 protein was positive in half the patients.All but one showed synaptic prion deposition with numerous kuru type plaques in the basal ganglia, anterior frontal and parietal cortex, thalamus, basal ganglia and cerebellum.The patient with the shortest clinical duration had an atypical synaptic deposition of abnormal prion protein and no kuru plaques.",https://openi.nlm.nih.gov/imgs/150/190/4620512/PMC4620512_awv235f2p.png
image0649.png,"MRI, MR","awv235-F3: MRI findings in a 47-year-old male patient with iatrogenic CJD due to growth hormone. Hyperintensity in the superior cerebellar vermis is seen on axial FLAIR images (A), and is more conspicuous at DWI at b = 1000s/mm2 at the same level (B). (C) A more superior axial image at DWI at b = 1000s/mm2 shows the increased vermian signal abnormality compared to the surrounding occipital cortex (Patient 8).","Bottom Line:The electroencephalogram was abnormal in 15 patients and cerebrospinal fluid 14-3-3 protein was positive in half the patients.All but one showed synaptic prion deposition with numerous kuru type plaques in the basal ganglia, anterior frontal and parietal cortex, thalamus, basal ganglia and cerebellum.The patient with the shortest clinical duration had an atypical synaptic deposition of abnormal prion protein and no kuru plaques.",https://openi.nlm.nih.gov/imgs/150/190/4620512/PMC4620512_awv235f3p.png
image0650.png,CT,F1: CT scan of the head without contrast showing multilobar hypodensity in the right hemisphere (arrows).,"Bottom Line:Time from symptom onset to thrombolysis is the most important determinant of the success of treatment, with greatest efficacy if given within 90 min.Hospitals should implement standardized processes and protocols for acute stroke to guide immediate patient assessment, brain imaging, drug administration, and post-thrombolysis care.In this article we review the clinical application of thrombolysis, care of acute stroke patients, current evidence regarding fibrinolysis, and future direction of penumbral imaging to select candidates for reperfusion therapies.",https://openi.nlm.nih.gov/imgs/150/160/3008863/PMC3008863_fneur-01-00139-g001.png
image0651.png,CT,"pone-0005091-g001: Demonstration stimulus for the Helmholtz-Kohlrausch effect.Top: Example of a stimulus used to measure the relationship between reflectance, luminance and brightness. Bottom: The wedge most frequently selected by subjects as the best match to the brightness of the blue dot. The wedges that are equally radiant and equally luminant with the blue dot are also indicated.","Bottom Line:This non-linear relationship between stimulus intensity and brightness, called the Helmholtz-Kohlrausch (HK) effect, was first described in the nineteenth century but has never been explained.Here, we take advantage of the relative simplicity of this 'illusion' to explain it and contextual effects more generally, by using a simple Bayesian ideal observer model of the human visual ecology.We show that the HK effect is a result of encoding the non-linear statistical relationship between retinal images and natural scenes that would have been experienced by the human visual system in the past.",https://openi.nlm.nih.gov/imgs/150/368/2659800/PMC2659800_pone.0005091.g001.png
image0652.png,"CT, MRI, MR","pone-0005091-g005: fMRI experiments: stimuli and results.Top row: The blue standard (left), equiluminant yellow (middle), and equally bright (right) annuli used in the first fMRI experiment; the relative responses (percent signal change) of primary visual cortex (V1) to the these stimuli (in the same left-to-right order as shown in the left panels) are shown on the right for two subjects (S1, S2). Error bars indicate one standard error. Bottom row: Blue standard (left), equiluminant low-saturated blue (middle), and equally bright low-saturated blue (right) annuli used in the second fMRI experiment; again the relative response of primary visual cortex (V1) of two subjects to these stimuli are indicated on the right (S2, S3). Display conventions are as for the upper row. Evidently V1 activity is consistent with the probable image-source relationship rather than the characteristics of the stimuli as such.","Bottom Line:This non-linear relationship between stimulus intensity and brightness, called the Helmholtz-Kohlrausch (HK) effect, was first described in the nineteenth century but has never been explained.Here, we take advantage of the relative simplicity of this 'illusion' to explain it and contextual effects more generally, by using a simple Bayesian ideal observer model of the human visual ecology.We show that the HK effect is a result of encoding the non-linear statistical relationship between retinal images and natural scenes that would have been experienced by the human visual system in the past.",https://openi.nlm.nih.gov/imgs/150/368/2659800/PMC2659800_pone.0005091.g005.png
image0653.png,CT,OMV074F1: CT brain (axial view) with contrast showing ring enhancing focal lesion in parafalcine frontal cortex with perilesional oedema.,"Bottom Line:The child improved, seizures stopped and the papilloedema gradually disappeared.Follow-up magnetic resonance imaging brain after 8 months showed a mild reduction in the size of the lesion.Child is on regular follow-up.",https://openi.nlm.nih.gov/imgs/150/341/4731740/PMC4731740_omv07401.png
image0654.png,"CT, Ultrasound, Magnetic resonance","f4-dddt-8-639: Evaluation of the ischemic zone following treatment with Hsp70.Notes: (A) Representative magnetic resonance scans of rat brains from the bovine serum albumin-treated control group and the Hsp70-treated experimental groups treated with protein concentrations of 0.5, 1.0, 2.5, and 5.0 mg/kg, respectively. Following treatment with Hsp70, magnetic resonance scans were obtained using the RARE-T1, TurboRARE-T2, FLASH and diffusion-weighted imaging (DWI) regimens. (B) Ultrasound dopplerography of the right middle cerebral artery depicting the cerebral blood flow before occlusion, during ischemia, and in the reperfusion phase. Each row corresponds to the respective magnetic resonance scan of the rat’s brain.",Bottom Line:Preliminary treatment with Hsp70 significantly reduced the ischemic zone (optimal response at 2.5 mg/kg).Administration of the Hsp70 decreased the infarction zone in a dose-dependent manner with an optimal (threefold) therapeutic response at 5 mg/kg.Long-term treatment of the ischemic rats with Hsp70 formulated in alginate granules with retarded release of protein further reduced the infarct volume in the brain as well as apoptotic area (annexin V staining).,https://openi.nlm.nih.gov/imgs/150/108/4044995/PMC4044995_dddt-8-639Fig4.png
image0655.png,CT,"F1: Functional imaging data in the normal and aphasic groups. (A) Activation related to speech comprehension in the normal (green) and aphasic (red) groups, determined by the contrast of narrative and control conditions. Statistical parametric maps are displayed using a voxel-level statistical threshold of P < 0.05, corrected for false discovery rate (FDR), with a cluster extent threshold equivalent to 5% of the total number of suprathreshold voxels (see Experimental Methods). SPMs have been rendered onto a template brain in standard MNI stereotactic space, with intensity scales representing T values. Ant = anterior. (B) Left anterolateral superior temporal functional connectivity in the normal (green-blue) and aphasic (red-yellow) groups. Statistical thresholding and display procedures are the same as in panel A. (C) Location of anatomical regions used in the region of interest analyses (upper row), displayed for comparison with the distribution and overlap of stroke lesions in the aphasic group (lower row). To assess lesion overlap, hand-drawn images of stroke lesions were normalized into standard MNI stereotactic space; regions of interest and lesion images are displayed on coronal slices of a canonical averaged T1-weighted MNI-space brain image available in SPM99. The intensity scale refers to the number of patients with lesions at a particular voxel.","Bottom Line:During normal narrative speech comprehension, left anterolateral superior temporal cortex displayed positive functional connections with left anterior basal temporal cortex, left inferior frontal gyrus and homotopic cortex in right anterolateral superior temporal cortex.We observed that deficits in auditory single word and sentence comprehension correlated both with the degree of disruption of left-right anterolateral superior temporal cortical connectivity and with local activation in the anterolateral superior temporal cortex.These results demonstrate that functional connectivity between anterolateral superior temporal cortex and right anterior superior temporal cortex is a marker of receptive language outcome after aphasic stroke, and illustrate that language system organization after focal brain lesions may be marked by complex signatures of altered local and pathway-level function.",https://openi.nlm.nih.gov/imgs/150/208/2792371/PMC2792371_awp270f1.png
image0656.png,Tomography,"F1: (a) Normal dopamine transporter single-photon emission computed tomography scan appearance, normal dopamine transporter scan appearance with head of the caudate nucleus appearing like a full stop (large arrow), and the putamen appearing like tail (small arrow). (b) Abnormal dopamine transporter scan in our patient: The left side is normal with normal putaminal tail (large arrow). The right side has abnormal tracer uptake - absence of putaminal tail, but the normal appearance of the caudate nucleus was like a full stop (small open arrow) (Type 1 abnormal uptake as per Benamer et al.)[2]",No bottom line,https://openi.nlm.nih.gov/imgs/150/236/4918501/PMC4918501_IJNM-31-249-g002.png
image0657.png,CT,"fig1: Corticospinal tract (CST) reconstructed using tractography superimposed on a subject's own FA color map in (a) sagittal, (b) axial, and (c) coronal planes.","Bottom Line:Abnormalities (P < 0.05) were observed in FA, AD, or RD in CST primarily at internal capsule (IC) level in ALS patients, especially those with CST hyperintensity.Clinical measures corresponded well with DTI changes at IC level.The IC abnormalities suggest a prominent axonopathy in UMN-predominant ALS and that tissue changes underlying CST hyperintensity have specific DTI changes, suggestive of unique axonal pathology.",https://openi.nlm.nih.gov/imgs/150/58/3205652/PMC3205652_JAR2011-481745.001.png
image0658.png,CT,fig6: Sagittal views of FA color maps showing tractography-derived CST extending up to the submotor cortex (SMC) level in a control subject (a) but truncated in an UMN-predominant ALS patient with CST hyperintensity (b).,"Bottom Line:Abnormalities (P < 0.05) were observed in FA, AD, or RD in CST primarily at internal capsule (IC) level in ALS patients, especially those with CST hyperintensity.Clinical measures corresponded well with DTI changes at IC level.The IC abnormalities suggest a prominent axonopathy in UMN-predominant ALS and that tissue changes underlying CST hyperintensity have specific DTI changes, suggestive of unique axonal pathology.",https://openi.nlm.nih.gov/imgs/150/58/3205652/PMC3205652_JAR2011-481745.006.png
image0659.png,"CT, Magnetic resonance",F1: Left thalamic infarct depicted on diffusion weighted and T2 weighted magnetic resonance scan (arrows).,Bottom Line:A 57 year old woman with a discreet left thalamic stroke and semantic paralexia is described.Language evalution with the Boston Diagnostic Aphasia Battery confirmed the semantic paralexia (deep alexia).A good recovery ensued.,https://openi.nlm.nih.gov/imgs/150/7/3349961/PMC3349961_ni-2012-1-e6-g001.png
image0660.png,CT,"fig1: Profiles of the DOT and the proposed derivations in a single crossing voxel from a real brain in the area of the centrum semiovale. The data is acquired at b = 1500 s/mm2 and 60 gradient directions. For the DOT, the effective diffusion time t is set to 25 ms. We observe that the DOT-mODF performs similarly as the DOT reconstructed at R0 = 16 μm. Additionally, Q-ball and the DOT-ODF show similar diffusion profiles.","Bottom Line:We propose a new analytical solution to the ODF derived from the DOT.Both techniques are analytical decomposition approaches that require identical acquisition and modest postprocessing times and, given the proposed modifications of the DOT, can be analyzed in a similar fashion.We find that an optimal HARDI protocol given a stringent time constraint (<10 min) combines a moderate b-value (around 2000 s/mm(2)) with a relatively low number of acquired directions (>48).",https://openi.nlm.nih.gov/imgs/150/63/3608261/PMC3608261_IJBI2013-658583.001.png
image0661.png,CT,"fig6: The effect of the truncation order of the spherical harmonics. The yellow rectangle marks the expected three-fold crossing of the CC, CR, and SLF. We observe more three-fold crossings at order ℓ = 3. Additionally, b = 3000 s/mm2 performs better than b = 1000 s/mm2, since more threefold crossings are recovered.","Bottom Line:We propose a new analytical solution to the ODF derived from the DOT.Both techniques are analytical decomposition approaches that require identical acquisition and modest postprocessing times and, given the proposed modifications of the DOT, can be analyzed in a similar fashion.We find that an optimal HARDI protocol given a stringent time constraint (<10 min) combines a moderate b-value (around 2000 s/mm(2)) with a relatively low number of acquired directions (>48).",https://openi.nlm.nih.gov/imgs/150/63/3608261/PMC3608261_IJBI2013-658583.006.png
image0662.png,CT,fig7: The effect of the b-value and the number of gradients at ℓ = 6. We observe that the crossings from CC and CR are already observed in the lowest parameter combination of b = 1000 s/mm2 and NG = 36. The SLF structures become more prominent at higher b ≥ 2000 s/mm2 (see yellow marked rectangles).,"Bottom Line:We propose a new analytical solution to the ODF derived from the DOT.Both techniques are analytical decomposition approaches that require identical acquisition and modest postprocessing times and, given the proposed modifications of the DOT, can be analyzed in a similar fashion.We find that an optimal HARDI protocol given a stringent time constraint (<10 min) combines a moderate b-value (around 2000 s/mm(2)) with a relatively low number of acquired directions (>48).",https://openi.nlm.nih.gov/imgs/150/63/3608261/PMC3608261_IJBI2013-658583.007.png
image0663.png,CT,"fig11: The effect of the b-value and the number of gradients at l = 6. At higher b-values we observe many spurious peaks that disappear with the increase of the number of gradients (see yellow marked rectangles). At NG ≥ 46 there is not a significant difference between the profiles at b = 2000 s/mm2 and b = 3000 s/mm2. Given that the spurious peaks are slightly more prominent at b = 3000 s/mm2, and that lower b-values are more attractive with respect to the total scanning time, we conclude that b = 2000 s/mm2 and NG ∈ [48; 72] are the optimal combination of parameters.","Bottom Line:We propose a new analytical solution to the ODF derived from the DOT.Both techniques are analytical decomposition approaches that require identical acquisition and modest postprocessing times and, given the proposed modifications of the DOT, can be analyzed in a similar fashion.We find that an optimal HARDI protocol given a stringent time constraint (<10 min) combines a moderate b-value (around 2000 s/mm(2)) with a relatively low number of acquired directions (>48).",https://openi.nlm.nih.gov/imgs/150/63/3608261/PMC3608261_IJBI2013-658583.011.png
image0664.png,CT,"fig12: The effect of the b-value and the number of gradients at l = 4. Conclusions are similar to Figure 11, however, at order ℓ = 4 it is more difficult to spot the threefold crossings.","Bottom Line:We propose a new analytical solution to the ODF derived from the DOT.Both techniques are analytical decomposition approaches that require identical acquisition and modest postprocessing times and, given the proposed modifications of the DOT, can be analyzed in a similar fashion.We find that an optimal HARDI protocol given a stringent time constraint (<10 min) combines a moderate b-value (around 2000 s/mm(2)) with a relatively low number of acquired directions (>48).",https://openi.nlm.nih.gov/imgs/150/63/3608261/PMC3608261_IJBI2013-658583.012.png
image0665.png,CT,"fig13: The effect of the b-value and the number of gradients at l = 4, maxima representation. Conclusions are the same as in Figure 12.","Bottom Line:We propose a new analytical solution to the ODF derived from the DOT.Both techniques are analytical decomposition approaches that require identical acquisition and modest postprocessing times and, given the proposed modifications of the DOT, can be analyzed in a similar fashion.We find that an optimal HARDI protocol given a stringent time constraint (<10 min) combines a moderate b-value (around 2000 s/mm(2)) with a relatively low number of acquired directions (>48).",https://openi.nlm.nih.gov/imgs/150/63/3608261/PMC3608261_IJBI2013-658583.013.png
image0666.png,CT,fig14: The effect of the averaging of the data at l = 6 in a Q-ball glyph representation. There is not a significant difference between the quality of the data without and with averaging even at higher b-values.,"Bottom Line:We propose a new analytical solution to the ODF derived from the DOT.Both techniques are analytical decomposition approaches that require identical acquisition and modest postprocessing times and, given the proposed modifications of the DOT, can be analyzed in a similar fashion.We find that an optimal HARDI protocol given a stringent time constraint (<10 min) combines a moderate b-value (around 2000 s/mm(2)) with a relatively low number of acquired directions (>48).",https://openi.nlm.nih.gov/imgs/150/63/3608261/PMC3608261_IJBI2013-658583.014.png
image0667.png,CT,fig15: The effect of the averaging of the data at l = 4 in a Q-ball glyph representation. There is not a significant difference between the quality of the data without and with averaging even at higher b-values.,"Bottom Line:We propose a new analytical solution to the ODF derived from the DOT.Both techniques are analytical decomposition approaches that require identical acquisition and modest postprocessing times and, given the proposed modifications of the DOT, can be analyzed in a similar fashion.We find that an optimal HARDI protocol given a stringent time constraint (<10 min) combines a moderate b-value (around 2000 s/mm(2)) with a relatively low number of acquired directions (>48).",https://openi.nlm.nih.gov/imgs/150/63/3608261/PMC3608261_IJBI2013-658583.015.png
image0668.png,CT,fig16: The effect of the averaging of the data at l = 4 represented by the maxima detected from Q-ball glyphs. There is not a significant difference between the quality of the data without and with averaging even at higher b-values.,"Bottom Line:We propose a new analytical solution to the ODF derived from the DOT.Both techniques are analytical decomposition approaches that require identical acquisition and modest postprocessing times and, given the proposed modifications of the DOT, can be analyzed in a similar fashion.We find that an optimal HARDI protocol given a stringent time constraint (<10 min) combines a moderate b-value (around 2000 s/mm(2)) with a relatively low number of acquired directions (>48).",https://openi.nlm.nih.gov/imgs/150/63/3608261/PMC3608261_IJBI2013-658583.016.png
image0669.png,CT,pone.0132958.g001: Feature selection (Gaussian SVM) identified brain regions in grey matter.PV—periventricular grey matter; C—caudate; IN—insula.,"Bottom Line:The use of quantitative methods to identify psychiatric biomarkers is consequently important, particularly with a view to making predictions relevant to individual patients, rather than at a group-level.Using an automated feature selection method, the major brain regions supporting this significant classification were in the caudate, insula, habenula and periventricular grey matter.It was not, however, possible to predict the degree of 'treatment resistance' in individual patients, at least as quantified by the Massachusetts General Hospital (MGH-S) clinical staging method; but the insula was again identified as a region of interest.",https://openi.nlm.nih.gov/imgs/150/110/4506147/PMC4506147_pone.0132958.g001.png
image0670.png,CT,"pone.0132958.g002: Group-level grey matter reductions in patients with TRD compared with healthy matched controls.PV- periventricular grey matter, C—caudate reductions, H—habenula and IN—insula.","Bottom Line:The use of quantitative methods to identify psychiatric biomarkers is consequently important, particularly with a view to making predictions relevant to individual patients, rather than at a group-level.Using an automated feature selection method, the major brain regions supporting this significant classification were in the caudate, insula, habenula and periventricular grey matter.It was not, however, possible to predict the degree of 'treatment resistance' in individual patients, at least as quantified by the Massachusetts General Hospital (MGH-S) clinical staging method; but the insula was again identified as a region of interest.",https://openi.nlm.nih.gov/imgs/150/110/4506147/PMC4506147_pone.0132958.g002.png
image0671.png,CT,pone.0132958.g003: Overlapping grey matter regions between features selected during classification (purple/blue) and regions selected in the VBM analysis (red/purple).,"Bottom Line:The use of quantitative methods to identify psychiatric biomarkers is consequently important, particularly with a view to making predictions relevant to individual patients, rather than at a group-level.Using an automated feature selection method, the major brain regions supporting this significant classification were in the caudate, insula, habenula and periventricular grey matter.It was not, however, possible to predict the degree of 'treatment resistance' in individual patients, at least as quantified by the Massachusetts General Hospital (MGH-S) clinical staging method; but the insula was again identified as a region of interest.",https://openi.nlm.nih.gov/imgs/150/110/4506147/PMC4506147_pone.0132958.g003.png
image0672.png,Unknown,fig2: Grey matter decreases from baseline to day 12 in (a) the right and left inferior frontal gyrus and (b) the insula bilaterally. (c) Positive correlation of the TQ difference with the GM concentration at baseline in the right frontal gyrus.,"Bottom Line:Transient GM decreases were detectable in several brain regions, especially in the insula and the inferior frontal cortex.These changes were not related to treatment outcome though.Baseline images correlated with change in tinnitus severity in the frontal cortex and the lingual gyrus, suggesting that GM at baseline might hold potential as a possible predictor for treatment outcome.",https://openi.nlm.nih.gov/imgs/150/390/4065728/PMC4065728_NP2014-132058.002.png
image0673.png,Unknown,"F9: 3D views of the p-values resulted from the voxel-wise unpaired t-test between the deformation maps of the in vivo group (n = 12, Figure 8B) versus the in vitro group (n = 10, Figure 8C). (A) Dorsal view. (B) Ventral view.","Bottom Line:With sufficient signal-to-noise (SNR) and contrast-to-noise ratio (CNR), 20 brain regions were identified.Our analyses revealed significant volumetric as well as unexpected geometrical differences between the in vivo and in vitro brain groups which in some instances were predictable (e.g. collapsed and smaller ventricles in vitro) but not in other instances.Based on these findings we conclude that although in vitro datasets, compared to in vivo images, offer higher spatial resolutions, superior SNR and CNR, leading to improved image segmentation, in vivo atlases are likely to be an overall better geometric match for in vivo studies, which are necessary for longitudinal examinations of the same animals and for functional brain activation studies.",https://openi.nlm.nih.gov/imgs/150/26/2525925/PMC2525925_fnana-02-001-g009.png
image0674.png,CT,"F2: Examples of segmentation results. Data sets of different origin [Leiden-Set(A–D), Cologne-Set(E)] were acquired at different time points after infarction induction [4 h (A), 24 h (B), 48 h (C,E) and 8 d (D)]. For each of the image panels, the first row illustrates reformatted raw image stack and the rest of the rows provide overlaid segmentation results by: automated (green) vs. Observer 1 (red), automated (green) vs. Observer 2 (red), Observer 1 (green) vs. Observer 2 (red), respectively. The regions where two segmentations overlap are colored in yellow. Image intensity was enhanced for visualization purposes.",No bottom line,https://openi.nlm.nih.gov/imgs/150/12/5281583/PMC5281583_fninf-11-00003-g0002.png
