Image Name,Scan Type(s),Scan Description,Bottom Line,Source URL
image0998.png,"CT, Tomography","F2: The computed tomography (CT) scan of brain showing left frontal penetrating injury causing multiple fractures and pneumocranium. Multiple bone fragments are displaced within brain parenchyma resulting in contusion and edema. This male patient, a blast victim, at presentation was localizing to pain and had right hemiparesis. He underwent craniotomy, debridement, including removal of superficial intracranial bone fragments, wound refashioning, and primary closure. Post - operative course was unremarkable and at 6 months follow - up, the patient was completely independent, although he had persistent mild hemiparesis","Bottom Line:Cerebrospinal fluid (CSF) leaks are common in PBI patients and surgical correction is recommended for those which do not close spontaneously or are refractory to CSF diversion through a ventricular or lumbar drain.The risk of post-traumatic epilepsy after PBI is high, and therefore, the use of prophylactic anticonvulsants is recommended.Advanced age, suicide attempts, associated coagulopathy, Glasgow coma scale score of 3 with bilaterally fixed and dilated pupils, and high initial intracranial pressure have been correlated with worse outcomes in PBI patients.",https://openi.nlm.nih.gov/imgs/150/25/3162712/PMC3162712_JETS-4-395-g002.png
image0999.png,"CT, PET","pone-0103745-g010: A FDDNP PET/CT scan subject with both head nodding and shaking movement showed reduction in artifacts in the temporal region, reduction in left-right asymmetry and better hemisphere separation after MC.Panels A and B show different brain slices of the same subject before and after MC.","Bottom Line:Image artifacts were significantly diminished after MC.There were significant differences (P<0.05) in the FDDNP DVR and FDG Ki values in the parietal and temporal regions after MC.In conclusion, MC applied to dynamic brain FDDNP and FDG PET/CT scans could improve the qualitative and quantitative aspects of images of both tracers.",https://openi.nlm.nih.gov/imgs/150/85/4128781/PMC4128781_pone.0103745.g010.png
image1000.png,"CT, PET","F5: (A) 11C-PIB PET scans at 56 and 58 years of age. The 11C-PIB images were derived from dynamic summations of standard uptake values (SUVs) over 40–60 min and were normalized with the cerebellum as a reference region (SUV/Ref). The colour scale indicates red (high), yellow (medium) and blue (low) 11C-PIB retention. The coregistered images represent transaxial, coronal and sagittal sections. (B) Comparison of 11C-PIB retention data in two scans in the following brain regions: frontal cortex (FC) (composite of frontal, cingulate anterior and frontal association cortices), parietal cortex (PC) (composite of upper and lower parietal cortices), parietotemporal cortex (PTC), cingulate posterior (CP), occipital cortex (OC), temporal cortex (TC) (composite of temporal inferior and lateral), medial temporal (MT), striatum (St), thalamus (Thal) and pons. With the exception of the pons, all brain regions are the average of the right and left hemisphere. To enable comparison between scans 1 and 2, the standard uptake values were normalized, with the cerebellum as a reference region. MMSE = mini-mental state examination.","Bottom Line:The patient showed a pronounced decline in cerebral glucose metabolism and cognition during disease progression, while Pittsburgh Compound B retention remained high and stable at follow-up.Neuropathological examination of the brain at autopsy confirmed the clinical diagnosis of pure Alzheimer's disease.In addition, a positive correlation was found between regional (11)C-Pittsburgh Compound B positron emission tomography retention and (3)H-Pittsburgh Compound B binding with the number of glial fibrillary acidic protein immunoreactive cells, but not with (3)H-L-deprenyl and (3)H-PK-11195 binding.",https://openi.nlm.nih.gov/imgs/150/338/3009843/PMC3009843_awq349f5.png
image1001.png,"Tomography, Magnetic resonance",F1: Brain computed tomography scan shows a subarachnoid hemorrhage at the basal cistern (A) and a oval lesion with contrast filling at the sellar region (B). Brain magnetic resonance imaging shows the optic chiasm (arrow heads) deviating upward by the aneurysm (arrow) (C). Cerebral catheter angiography in the left internal carotid artery demonstrates an 18×8 mm dumbbell-shaped aneurysm at the anterior communicating artery (D).,Bottom Line:Here we present an unusual case of bitemporal hemianopsia caused by a large intracranial aneurysm of the ACoA.A 41-year-old woman was admitted to our neurosurgical department with a sudden-onset bursting headache and visual impairment.Microscopic aneurysmal clipping was performed.,https://openi.nlm.nih.gov/imgs/150/17/4630364/PMC4630364_jkns-58-291-g001.png
image1002.png,"CT, MRI, MR","F1: Illustration of the effects of physiological state on VBM results. T1-weighted MPRAGE structural MRI scans were acquired in nicotine-dependent individuals after recently smoking (Smoke condition) or maintaining 5 h of monitored abstinence (No Smoke condition) and compared. Use of VBM to reveal gray matter indices showed significantly greater gray matter volume in the Smoke compared to the No Smoke condition in bilateral ventral striatum. Data are shown overlain on the Montreal Neurological Institute (MNI) template brain using neurological convention (left is left). X, Y, Z, coordinates shown are from the peak voxel; left, −22 6 −2 [143 voxels, t(37) = 2.93, p = 0.006] and right, 28 8 −2, [423 voxels, t(37) = 3.18, p = 0.003]. The color bar represents the t-values from the statistical maps (left, T = 3.09; right, T = 3.20).",No bottom line,https://openi.nlm.nih.gov/imgs/150/370/4309115/PMC4309115_fnhum-08-01052-g0001.png
image1003.png,"CT, Tomography","F1: (a) Computed tomography scans show large left mid and high parietal intracerebral hematoma with midline shift, (b) scalp markers on patient's head as rectangular mark is the hematoma, the circular mark is site proposed to be around the bur hole, and the two pints is the sites to place brain cannula, (c) the tinny burr hole used to evacuate hematoma, and (d) computed tomography scans show highly significantly evacuated large hematoma with subsequently resolved midline shift",No bottom line,https://openi.nlm.nih.gov/imgs/150/327/4821951/PMC4821951_JNRP-7-315-g001.png
image1004.png,"Tomography, Magnetic resonance",F1: Brain neuroimaging studies performed on the day when the diagnosis of ventriculitis was made. Only the diffusion sequences clearly show the intraventricular debris. A. computed tomography scan; B. magnetic resonance T2 sequence; C. magnetic resonance FLAIR sequence; D. magnetic resonance diffusion sequence. Purulent material inside the ventriculi is indicated by the arrows.,"Bottom Line:Cerebrospinal fluid cultural examination showed methicillin-resistant Staphylococcus aureus and vancomycin treatment lead to a complete recovery.The present case underlines the importance of taking into account the diagnosis of pyogenic ventriculitis even when the neurological picture does not match the suspect of a central nervous system infection.Moreover, brain computed tomography scan and standard magnetic resonance imaging sequences may be unable to confirm the diagnosis, whereas diffusion-weighted sequences prove a unique role in diagnosing cerebral pyogenic ventriculitis.",https://openi.nlm.nih.gov/imgs/150/128/3986469/PMC3986469_1756-0500-7-149-1.png
image1005.png,CT,F2: CT scan: watershed cerebral infarct between the right middle and the right posterior cerebral arterial territories.,"Bottom Line:This feature is interesting because it may be documented by computed tomography (CT) scan and particular electroencephalography signals.It appears that our observation represents the first documented case of Capgras syndrome complicating ECMO.In addition, it shows that this psychiatric symptom (that has been interpreted psychodynamically for many years) can have an organic basis, which should be studied.",https://openi.nlm.nih.gov/imgs/150/117/37410/PMC37410_CC-5-4-232-2.png
image1006.png,"CT, MRI, MR","pone-0062238-g002: Longitudinal MRI monitoring of the initiation and development of intracranial brain metastases.A. MRI scans of the whole mouse brain were initiated 3 weeks after intracardiac injection of MDA-MB231Br cells and repeated once a week for 2 weeks. Four consecutive coronal MRI sections of a representative mouse brain showed no apparent intracranial lesions on T2-weighted images. However, follow-up images at week 4 identified multiple lesions with hyper-intensity on T2-weighted images (arrowhead), but none of them was enhanced on T1-weighted post contrast images. An increased number of lesions (arrowheads) appeared on the images at week 5, only a few of which (arrowheads) were enhanced post Gd-DTPA. B. Corresponding histological sections of H&E staining showed a good correlation with MRI. C. MRI evaluation of a total of 464 metastases in 9 mice brains indicated that these metastases distributed through the whole mouse brain with a higher incidence in the brain cortex (49%). Note: OB: Olfactory bulb; BG: Basal ganglia; Hippo: Hippocampus.","Bottom Line:Using a 9.4T system, high resolution anatomic MRI and dynamic susceptibility contrast (DSC) perfusion MRI were acquired at different time points after an intracardiac injection of brain-tropic breast cancer MDA-MB231BR-EGFP cells.The rCBV data were concordant with histological analysis of microvascular density (MVD).Moreover, comprehensive analysis suggested no significant correlation among tumor size, rCBV and BTB permeability.",https://openi.nlm.nih.gov/imgs/150/211/3639286/PMC3639286_pone.0062238.g002.png
image1007.png,CT,"F2: Brain CT scans obtained in a 71-year-old patient who presented with stuporous consciousness and underwent TDC at the PCP with closed-system drainage. However, the subdural catheter was positioned into the wrong space. A : Postoperative axial brain CT scans showing catheter positioned in the epidural space. B : Axial soft tissue algorithm brain CT scan obtained 1 month after BHD. The hematoma had resolved completely, and the patient's neurological function had improved. TDC : twist-drill craniostomy, PCP : pre-coronal point, BHD : burr-hole drainage.","Bottom Line:Of the 134 CSDH patients, 114 (85.1%) showed improved clinical performance and imaging findings after surgery.Recurrent cases were seen in eight patients (5.6%), and they were improved with a second BHD with a closed-system operation.TDC at the PCP with closed-system drainage is safe and effective for patients with symptomatic CSDH whose hematomas extend beyond the coronal suture.",https://openi.nlm.nih.gov/imgs/150/325/3467371/PMC3467371_jkns-52-133-g002.png
image1008.png,CT,"F3: 2ndpart of a series of horizontal vibratome sections of the brain ofSpeleonectes tulumensis. (A-D) Dorsal to ventral series of vibratome sections (50 μm) through the brain of Speleonectes tulumensis triple labeled for serotonin immunoreactivity (5HT-IR, green), acetylated α-tubulin immunoreactivity (TUB-IR, magenta) and nuclear marker (NUC, blue). Maximum projections consisting of 31 to 41 confocal laser-scans per slice. Abbreviations: capital letters A, D: soma clusters; DCC: deutocerebral commissural neurites; LAN2: lateral antenna 1 neuropil 2; MAN: medial antenna 1 neuropil; ON: olfactory neuropil; sA2, sD1, sD2, sE1, sE2: 5HT-ir cell groups; TCN: tritocerebral neuropil.","Bottom Line:Furthermore, Remipedia display several synapomorphies with Malacostraca supporting a sister group relationship between both taxa.These homologies include a chiasm of the olfactory globular tract, which connects the olfactory neuropils with the lateral protocerebrum and the presence of hemiellipsoid bodies.Even though a growing number of molecular investigations unites Remipedia and Cephalocarida, our neuroanatomical comparison does not provide support for such a sister group relationship.",https://openi.nlm.nih.gov/imgs/150/356/3497878/PMC3497878_1471-2148-12-168-3.png
image1009.png,"MRI, MR","F1: Representative axial slices from clinical MRI scans of the TBI patient. T1-weighted (top row), FLAIR (middle row) and T2-weighted images. The scans were interpreted as normal at the initial neuroradiological examination. Images are displayed according to radiological convention (right side of the brain is shown on the left side of figure).","Bottom Line:Patients with traumatic brain injury (TBI) often present with significant cognitive deficits without corresponding evidence of cortical damage on neuroradiological examinations.The results were statistically analyzed as z-scores from the mean with a p < 0.05 criterion, corrected for multiple comparisons.False positive rates were verified by comparing the data from each control subject with the data from the remaining control population using identical statistical procedures.",https://openi.nlm.nih.gov/imgs/150/93/2811103/PMC2811103_1471-2342-9-20-1.png
image1010.png,Unknown,"fig2: (a) Brain tissue infiltrated by an adenocarcinoma, original magnification ×40. (b) Immunohistochemical cytoplasmic stain for CK 20, a low-grade cytokeratin typical for colonic origin, original magnification ×100.","Bottom Line:Up to one third of the patients do not have previous cancer history.In cases of undiagnosed primary lesions, patients present in better general condition, but overall survival does not change.Eventual identification of the primary tumor does not affect survival.",https://openi.nlm.nih.gov/imgs/150/63/3502798/PMC3502798_CRIM.ONCMED2012-192807.002.png
image1011.png,"CT, MRI, Magnetic resonance, MR","Fig1: Magnetic resonance imaging (MRI) study in the patient with 4H leukodystrophy. (a) T1W (T1-weighted) axial scan of the brain indicating hypomyelination; (b) T2W (T2-weighted) scan of the brain and T2W-hypointensity of the globi pallidi; (c) affection of the middle cerebellar peduncles:T2W scan; (d) T2W-hypointensity of the nucleus dentatus; (e) atrophy of the cerebellum, brainstem, corpus callosum and the adenohypophisis: sagittal T1W scan; (f) the small adenohypophysis: coronal T1W scan + contrast; (g) Magnetic resonance spectroscopy: decreased choline/creatine ratio in the lesions; (h) Diffusion tensor imaging of the brain supporting hypomyelination; (i, j) the unaffected spinal cord: T2W scans.","Bottom Line:A 32-year-old Caucasian female exhibited chronic urinary incontinence that commenced at the age of 7 years and remained the unexplained symptom more than two decades before the onset of progressive neurologic decline.A transient growth failure and absent sexual development with hypoprolactinemia appeared in the meanwhile.Neurologic, endocrine, neuroradiologic, and genetic evaluation performed only in the patient's thirties, confirmed the diagnosis of 4H leukodystrophy as the only cause of the micturition disturbance.",https://openi.nlm.nih.gov/imgs/150/260/4351912/PMC4351912_12883_2015_283_Fig1_HTML.png
image1012.png,CT,"FIG1: Brain CT Scan ImagesFigure 1A: Pre-op brain CT scan image demonstrating a large right subacute subdural hematoma causing subfalcine herniation, impending uncal herniation, right to the left shift of 1.0 cm mass effect and ipsilateral ventricles.Figure 1B: Brain CT scan demonstrating status post neurosurgical evacuation of right subdural hematoma. - Burr holes are present at the parietal convexity. Subdural drainage catheter, stable in position. Previously present right subdural air has resolved. No extra-axial fluid collections identified from the level of the foramen of Monro to the convexity. No acute intracranial hemorrhage.","Bottom Line:The rates of postoperative hemorrhage, infection, distal catheter revision, and perioperative seizures was found to be zero percent.There was no significant relationship between complications and the use of anticoagulants four weeks after surgery.When pursuing this treatment, this technique is recommended to mitigate the risks of repeat surgical intervention and lessen perioperative time in high-risk patients.",https://openi.nlm.nih.gov/imgs/150/212/4914066/PMC4914066_cureus-0008-000000000613-i01.png
image1013.png,"Tomography, Magnetic resonance","F0001: (a) Magnetic resonance imaging of the brain showing a hypodense lesion surrounded by perilesional edema in the right parietal lobe and edema in the left parietal lobe, (b) The computerised tomography scan of the brain showing a calcified lesion in the soft tissue of the scalp and (c) multiple calcified lesions located bilaterally in the brain parenchyma",No bottom line,https://openi.nlm.nih.gov/imgs/150/332/3108082/PMC3108082_AIAN-14-56-g001.png
image1014.png,CT,"F4: Microdialysis catheter placement. (a) Number of catheters that were determined by postoperative CT scans to be in normal or abnormal appearing brain. Abnormal appearing brain on CT scans included areas of low attenuation (edema) or areas of hemorrhage (from the injury). Some of the catheters were also in the ventricles or could not be seen. Presumably, the latter had been pulled out during the closure or transport and were not in the brain. (b) Example of a patient with a right frontal–parietal cranial defect after deompressive craniectomy. The arrow points to a left frontal microdialysis catheter inserted via a bolt. The tip appears to be in normal appearing brain by CT criteria. (c) The same patient in b demonstrating another catheter (denoted by the arrow) in an area of low attenuation suggestive of edema or ischemia",Bottom Line:None were associated with cranial infection.No cerebral hemorrhages or infections were attributed to cerebral MD.Examples of how MD may be a useful adjunct in the clinical decision making of patients with brain injuries are presented.,https://openi.nlm.nih.gov/imgs/150/225/3385066/PMC3385066_SNI-3-57-g007.png
image1015.png,CT,"Fig1: Age-specific, horizontally oriented templates are shown for each study time point. Each template represents an average brain image constructed from the individual subject scans. Images display enhanced signal-to-noise and optimal shape characteristics relative to individual scans. Scale bar represents 1 cm","Bottom Line:Brain volume of the male subjects was always, on average, larger than the female subjects.A variety of allometric measurements were also acquired and body weight gain was most closely associated with the rate of brain growth.These findings provide a valuable baseline for the effects of fetal and early postnatal manipulations on the pattern of abnormal brain growth related to neurodevelopmental disorders.",https://openi.nlm.nih.gov/imgs/150/29/4884209/PMC4884209_429_2015_1076_Fig1_HTML.png
image1016.png,Tomography,"F1: Preoperative imaging, brain computed tomography scan (with contrast)","Bottom Line:In a two-year-follow-up he remains recurrence-free.In the current cost-effective era it is still possible to safely remove an intraventricular trigonal meningioma without the convenience of neuronavigation.Since the best neuronavigator is the profound neuroanatomical knowledge, no technological advancement could replace a well-educated and trained neurosurgeon.",https://openi.nlm.nih.gov/imgs/150/116/3162803/PMC3162803_SNI-2-113-g001.png
image1017.png,CT,fig2: Case 2 CT scan of head: axial and sagittal cuts showing foci of gas in bilateral cerebral arteries (blue arrows).,No bottom line,https://openi.nlm.nih.gov/imgs/150/303/5011199/PMC5011199_CRICC2016-3425321.002.png
image1018.png,"CT, Tomography",f3-ott-9-013: Enhanced brain computed tomography scan showing that erlotinib treatment combined with whole-brain radiation therapy was effective for the patient.Notes: Enhanced brain computed tomography scan revealing metastasis in the right occipital lobe (A). This metastasis significantly shrank after erlotinib treatment combined with whole-brain radiation therapy until September 2009 (B).,"Bottom Line:The patient then received gefitinib (250 mg/day) as a maintenance therapy until the end of the follow-up period.Erlotinib was well tolerated in combination with whole-brain radiation therapy and a favorable objective response rate was observed.Furthermore, targeted drug treatment warrants consideration in patients with a negative epidermal growth factor receptor mutation status and male patients with a history of smoking.",https://openi.nlm.nih.gov/imgs/150/148/4690645/PMC4690645_ott-9-013Fig3.png
image1019.png,CT,F2: (a) Brain CT scan revealing a large depressed fracture over left frontal region; (b) Brain CT scan with bone window to confirmed a large depressed fracture over left frontal region,Bottom Line:Wooden foreign bodies often pose a different set of challenges as far as penetrating injuries to the brain are concerned.Radiological difficulties and increased rates of infection due to its porous nature make these types of injuries particularly interesting.Their early diagnosis and appropriate treatment can minimize the risk of complications.,https://openi.nlm.nih.gov/imgs/150/350/3532759/PMC3532759_AJNS-7-131-g002.png
image1020.png,"CT, Tomography",F2: Three lesion patterns on postmortem CT images of brain.A. Pattern 1. CT scan of 53-year-old deceased woman obtained 1 hour and 35 minutes after death shows unremarkable postmortem changes (case 2). B. Pattern 2. CT scan of 39-year-old deceased woman obtained 9 hours and 9 minutes after death shows diffuse brain swelling (case 3). C. Pattern 3. CT scan of 78-year-old deceased man obtained 14 hours and 41 minutes after death shows both diffuse brain swelling and loss of distinction between gray and white matter (case 4). CT = computed tomography,"Bottom Line:Computed tomography (CT) is widely used in postmortem investigations as an adjunct to the traditional autopsy in forensic medicine.However, on interpretation, postmortem CT findings that are seemingly due to normal postmortem changes initially, may not have been mere postmortem artifacts.In this pictorial essay, we describe the common postmortem CT findings in cases of atraumatic in-hospital death and describe the diagnostic pitfalls of normal postmortem changes that can mimic real pathologic lesions.",https://openi.nlm.nih.gov/imgs/150/324/4499544/PMC4499544_kjr-16-798-g002.png
image1021.png,Magnetic resonance,F1: Magnetic resonance imaging scan T2 axial view at level of midbrain. Arrow points to area of compression of left cerebral peduncle by posterior cerebral artery. Clear space filled with cerebral fluid is seen on the right.,Bottom Line:Medical treatment and operative procedures provide symptomatic relief only.They returned 18 months later with contralateral peduncle compression.Vascular compression of the cerebral peduncle by the posterior cerebral artery may be associated with Parkinson's Disease in some patients.,https://openi.nlm.nih.gov/imgs/150/35/3207233/PMC3207233_ni-2011-2-e7-g001.png
image1022.png,CT,"pone-0108904-g004: PWML in an infant without additional lesions who developed cerebral palsy.T1-weighted images at early (born at 31 weeks, postmenstrual age at scan 33 weeks, (A)) and term equivalent age (B) in an infant with lesions in a cluster pattern. Note that the lesions seem to be directly in the path of the corticospinal tracts (see arrow for an example). Lesions show high signal intensity, suggestive of restricted diffusion, on DWI of the early scan (C) and these are visible in the same location on T1-weighted imaging at term equivalent age (D). No signal intensity changes were seen on SWI on either scan and no additional lesions were identified. At term equivalent age, the posterior limb of the internal capsule appears to be less well developed on the right side. This infant subsequently developed a mild asymmetric bilateral spastic cerebral palsy, with her left leg being most severely affected.","Bottom Line:Different patterns of punctate white matter lesions did appear: a linear appearance associated with signal loss on SWI, and a cluster appearance associated with restricted diffusion on DWI on the first MRI.These different patterns are suggestive of a difference in underlying pathophysiology.To reliably classify PWML in the preterm infant in either pattern, an early MRI with DWI and SWI sequences is required.",https://openi.nlm.nih.gov/imgs/150/2/4184838/PMC4184838_pone.0108904.g004.png
image1023.png,"CT, PET","f5: Evaluation of the neuroprotective effect of FK506-liposomes by use of the MC-I-specific PET probe [18F]BCPP-EF.PET scans were performed for 60 min with [18F]BCPP-EF (10 MBq/rat) at 1, 3, and 7 days after reperfusion. Summation PET images from 10 to 30 min were reconstructed to obtain standardized uptake value (SUV) images. The PET images were superimposed on the corresponding X-CT images. The black dotted circles (the images in day 1) indicate the position of the brain in the PET/CT images. The red arrows in the images indicate the ischemic hemisphere (right brain hemisphere), and the bar shows the relative level of signal intensity ranging from high (red) to low (blue).","Bottom Line:The PET imaging using [(18)F]BCPP-EF showed a prominent reduction in the MC-I activity in the ischemic brain hemisphere.Additionally, the PET scan could diagnose the extent of the brain damage accurately and showed the neuroprotective effect of FK506-liposomes at Day 7, at which 2, 3, 5-triphenyltetrazolium chloride staining couldn't visualize them.Our study demonstrated that the PET technology using [(18)F]BCPP-EF has a potent capacity to evaluate the therapeutic effect of drug candidates in living brain.",https://openi.nlm.nih.gov/imgs/150/233/4954989/PMC4954989_srep30127-f5.png
