Image Name,Scan Type(s),Scan Description,Bottom Line,Source URL
image0001.png,CT,"figure3: On an iOS device, an NCCT brain scan shown in image a was incorrectly interpreted as having a dense MCA sign (arrow). On an iOS device, a CT angiography brain scan (image b) demonstrates a normal patent vessel. On the workstation monitor, an NCCT brain image c shows nearly the same Hounsfield units (open rectangles) of both vessel segments, thus avoiding the error made on the iOS device.","Bottom Line:The interpretations made on an iOS device were compared with those made at a workstation.No significant difference (P<.05) was noted in the interpretation time between the workstation and iOS device.Generalizing conclusions about its clinical utility, especially in other diagnostic use cases, should not be made until additional studies are performed.",https://openi.nlm.nih.gov/imgs/150/147/3221380/PMC3221380_jmir_v13i2e31_fig3.png
image0002.png,"CT, Tomography",F2: Postoperative plain computed tomography scan brain: (a) Plain CT scan brain showing the mass lesion in the right cerebellar region; (b-d) plain CT scan brain showing the evacuated hematoma with the shunt tube in situ,Bottom Line:Ventriculo peritoneal (VP) shunt uncommonly complicates as intracranial hematomas which can still occur in patients with a functioning VP shunt leading to a delay in the diagnosis which can be extremely dangerous and lead to adverse outcomes.We report a case of an incidental diagnosis of delayed post-operative EDH following VP shunt in an young adult patient with a right cerebellar lesion and highlight the need for meticulous post-operative neurological examination.,https://openi.nlm.nih.gov/imgs/150/215/4244800/PMC4244800_JNRP-6-94-g002.png
image0003.png,"Tomography, Magnetic resonance","F1: Brain imaging studies. (a) Pre-treatment brain magnetic resonance imaging scan showing bilateral mesial temporal high T2 signal intensity (arrows). (b) Pre-treatment brain positron emission tomography/computed tomography brain scan revealing a focus of intensely increased 18F-fluorodeoxyglucose uptake limited to the head of the right hippocampus (arrow) on a background of globally decreased 18F-fluorodeoxyglucose uptake. (c) Post-treatment brain magnetic resonance imaging scan showing marked improvement in the previously identified bilateral hyperintensities, which were replaced by atrophy (arrows). (d) Post-treatment positron emission tomography brain scan showing normal 18F-fluorodeoxyglucose uptake in the right hippocampus.","Bottom Line:The results of his initial physical examination were normal.An 18F-fluorodeoxyglucose positron emission tomography brain scan showed intensely increased 18F-fluorodeoxyglucose uptake limited to the head of the right hippocampus.He responded to penicillin treatment with an improvement in his cognition, which was further reflected in a complete resolution of the findings previously seen on magnetic resonance imaging and 18F-fluorodeoxyglucose positron emission tomography scans.",https://openi.nlm.nih.gov/imgs/150/389/3514352/PMC3514352_1752-1947-6-389-1.png
image0004.png,"CT, MRI, MR","f3-kjim-10-2-160-14: MRI brain scan after occurrence of diplopia on lateral gaze shows nodular hyperintense lesion in posterior aspect of mid-brain on contrast enhanced T1-WI.MRI brain scan after brain radiotherapy with 2520 cGY shows nearly complete resolution of previously noted nodular hyperintense lesion in mid-brain.CT scan of brain after development of left-sided hemiplegia reveals relatively well defined, round inhomogeneous enhanced hyperdense mass lesion with surrounding edema in right parietal region.",Bottom Line:Granulocytic sarcoma is rare extramedullary tumor composed of myeloblasts and other granulocytic precursors.The majority of cases have been reported in association with acute myeloid leukemia (AML) or myeloproliferative disorders.Granulocytic sarcoma may occur in patients with myelodysplastic syndromes.,https://openi.nlm.nih.gov/imgs/150/349/4532050/PMC4532050_kjim-10-2-160-14f3.png
image0005.png,"CT, Tomography","FI1400007cr-3: Postoperative CT brain scan showing a postoperative cervical pseudomeningocele with ventricular size enlarged (a, b) and subsequent resolution of hydrocephalus after a ventriculoperitoneal shunting (c, d). CT, computed tomography.","Bottom Line:A CT brain scan showed a postoperative cervical pseudomeningocele and an increase in the ventricular sizes, resulting in hydrocephalus.Results A ventriculoperitoneal shunting was performed using a programmable valve opening pressure set to 120 mmH20.After surgery, the patient's neurological status markedly improved.",https://openi.nlm.nih.gov/imgs/150/193/4212698/PMC4212698_10-1055-s-0034-1387805-i1400007cr-3.png
image0006.png,CT,F1: (a) Preoperative CT brain scan showing SAH in Rt. sylvian fissure and Rt. ambient cistern (b) CT brain scan showing clearance of subarachnoid blood (post-FLUX use),Bottom Line:We were successful in clearing cisternal blood in three patients with aneurysmal rupture with fluid exchange catheter system.The result is good clearance of blood in subarachnoid spaces were seen in all the patients.We conclude that the fluid exchange catheter system is safe and adoptable in neurosurgical practice.,https://openi.nlm.nih.gov/imgs/150/61/3410165/PMC3410165_AJNS-7-78-g001.png
image0007.png,CT,"fig7: HTT10150 shows no toxicity in DARPP-32-positive neurons around the site of injection. HTT10150 was unilaterally injected into the striatum of WT (FVB/NJ) mice. Brains were collected after 5 days, fixed, sectioned, and stained with antibodies against DARPP-32 (a–d). Representative image of striatum after injection of (a,b) ACSF, full brain scan and ×60 magnification or (c,d) 12.5 µg HTT10150, full brain scan and ×60 magnification. (a) Quantification of DARPP-32–positive neurons (n = 3 mice, mean ± SD). Images are representative results confirmed in separate images of all injected brains.",No bottom line,https://openi.nlm.nih.gov/imgs/150/27/5014532/PMC5014532_mtna201538f7.png
image0008.png,CT,"F2: (a) CT brain scan showing hematoma and subarachnoid blood in right ambient cistern, immediately after clipping (b) Seventy two hours post-irrigation CT brain scan showing clearance of subarachnoid blood, FLUX catheter in situ",Bottom Line:We were successful in clearing cisternal blood in three patients with aneurysmal rupture with fluid exchange catheter system.The result is good clearance of blood in subarachnoid spaces were seen in all the patients.We conclude that the fluid exchange catheter system is safe and adoptable in neurosurgical practice.,https://openi.nlm.nih.gov/imgs/150/61/3410165/PMC3410165_AJNS-7-78-g002.png
image0009.png,CT,F1: Preoperative CT brain scan Sample figure title. CT brain scan-Old ischemic findings in the right hemisphere.,Bottom Line:The differential diagnosis of clots and myxomas in the left atrium is mostly based on echocardiography.Infection of intracardiac thrombi is extremely rare and mostly reported in ventricular clots or aneurysms following myocardial infarction.Although the patient underwent prompt surgery with removal of the clot and valve replacement the complication of septic emboli to the CNS led her to death.,https://openi.nlm.nih.gov/imgs/150/265/2373784/PMC2373784_1749-8090-3-18-1.png
image0010.png,Unknown,f0010: Whole-brain representation of classification analysis (reproducible) brain map (p < 0.05FDR). Increasing the signal locally in cold areas will make a particular brain scan more likely to be classified as a KS patient. Increasing the signal locally in warm areas will make a brain scan more likely to be classified as a control.,"Bottom Line:Compared to controls, KS patients had significantly decreased GMV bilaterally in insula, putamen, caudate, hippocampus, amygdala, temporal pole and frontal inferior orbita.Regression analyses, however, revealed no significant association between GMV differences and cognitive and psychological factors within the KS patients and controls or the groups combined.These results show that although gene dosage effect of having and extra X-chromosome may lead to large scale alterations of brain morphometry and extended cognitive disabilities no simple correspondence links these measures.",https://openi.nlm.nih.gov/imgs/150/115/3830066/PMC3830066_gr2.png
image0011.png,CT,F1: CT brain scan.,"Bottom Line:Isolated meningeal recurrence is particularly uncommon, and we present an unusual case of this in a 58-year-old man.The case was further complicated by the somewhat atypical presentation with a confirmed ischaemic stroke.The patient died one month after presentation.",https://openi.nlm.nih.gov/imgs/150/314/2919995/PMC2919995_cro0003-0171-f01.png
image0012.png,"MRI, MR",F2: MRI brain scan.,"Bottom Line:Isolated meningeal recurrence is particularly uncommon, and we present an unusual case of this in a 58-year-old man.The case was further complicated by the somewhat atypical presentation with a confirmed ischaemic stroke.The patient died one month after presentation.",https://openi.nlm.nih.gov/imgs/150/314/2919995/PMC2919995_cro0003-0171-f02.png
image0013.png,"MRI, MR",F1: MRI brain scan (T1 with contrast and FLAIR),Bottom Line:Surgical intervention was recommended because the seizures were resistant to treatment and also because the diagnosis could not be clearly established.Some cases may be difficult to diagnose.Clinical presentation of seizure and brain imaging should be given priority over blood investigations for diagnosing neurocysticercosis and advanced neurosurgical intervention can be considered in suitable cases for better outcome.,https://openi.nlm.nih.gov/imgs/150/71/3263008/PMC3263008_SNI-2-177-g001.png
image0014.png,"CT, MRI, Magnetic resonance, MR","fig02: A, the left panel shows a coronal section through an MRI brain scan. Zooming in progressively further (middle and then right panels), the voxels that make up the scan are evident. B, the left panel shows a schematic diagram of some voxels from a functional magnetic resonance imaging (fMRI) brain scan. The pink line indicates the statistical threshold for activation, with some of the voxels passing the threshold and others not. With this conventional approach to analysing fMRI data, each voxel is considered separately. The right panel shows another view (from overhead) of the same set of voxels. A pattern across voxels is now evident. This focus on patterns of fMRI activity across voxels is known as multi-voxel pattern analysis (MVPA).","Bottom Line:This is because the study of specific neural signatures of autobiographical memories in vivo in humans presents a significant challenge.Here, I describe how the application of 'decoding' techniques to brain-imaging data is beginning to disclose how individual autobiographical memory representations evolve over time, deepening our understanding of systems-level consolidation.In particular, this prompts new questions about the roles of the hippocampus and ventromedial prefrontal cortex and offers new opportunities to interrogate the elusive memory trace that has for so long confounded neuroscientists.",https://openi.nlm.nih.gov/imgs/150/155/4015368/PMC4015368_eph0099-0471-f2.png
image0015.png,"CT, Tomography, Magnetic resonance",F1: Left hand figure: Plain computed tomography scan brain showing calcified cyst of the left parietal cortex (narrow single line arrow) middle figure: CT scan brain showing ring enhancing lesion (transitional cyst) of the right frontal lobe with perilesional edema with scolices from 1 to 6 O’ clock position right hand figure: Magnetic resonance imaging brain (T2-weighted) showing an active cyst (double line black arrow) and transitional cyst demonstrating a scolex as white dot (triangular black arrow head),"Bottom Line:Solitary ring enhancing lesions (transitional stage) involving the parietal lobe was the commonest CT picture at presentation.Generalized tonic-clonic seizure was the most common type of seizure.Number of lesions, persistence of lesion, number of seizures, EEG abnormality at presentation were not found to be prognostically significant (P > 0.05).",https://openi.nlm.nih.gov/imgs/150/18/3841598/PMC3841598_AIAN-16-549-g002.png
image0016.png,CT,F2: Intraoperative photograph showing the lesion next to the cortical incision and postoperative CT brain scan showing successful removal of the lesion,Bottom Line:Surgical intervention was recommended because the seizures were resistant to treatment and also because the diagnosis could not be clearly established.Some cases may be difficult to diagnose.Clinical presentation of seizure and brain imaging should be given priority over blood investigations for diagnosing neurocysticercosis and advanced neurosurgical intervention can be considered in suitable cases for better outcome.,https://openi.nlm.nih.gov/imgs/150/71/3263008/PMC3263008_SNI-2-177-g002.png
image0017.png,"CT, MRI, MR","epi13358-fig-0001: Radiologic and electrographic features. (A) MRI brain scan for patient 1, 7 months of age: Sagittal T1‐weighted and coronal T2‐weighted imaging showing generalized reduction in white matter bulk and marked cerebellar atrophy (yellow arrow) and corpus callosum thinning (blue arrow) with relative sparing of the pons. (B) Last EEG of patient 1, at 6 years of age, continued to show frequent epileptiform activity more prevalent over the posterior regions. (C) MRI brain scan of patient 2, age 6 months: Sagittal T1‐weighted and coronal T2‐weighted imaging shows marked cerebellar atrophy (yellow arrow), thinning of the corpus callosum (blue arrow), relative sparing of the pons, and reduction in white matter bulk. (D) EEG of patient 2, age 5 months: EEG showed frequent bursts of polymorphic high‐amplitude focal sharp delta/theta over both posterior temporal regions with a bias to the right.","Bottom Line:Pontocerebellar hypoplasia is a group of heterogeneous neurodevelopmental disorders characterized by reduced volume of the brainstem and cerebellum.Using whole exome sequencing techniques, both were found to be compound heterozygotes for one previously reported and one novel mutation in the gene encoding mitochondrial arginyl-tRNA synthetase 2 (RARS2).Mutations in this gene have been classically described in pontocerebellar hypoplasia type six (PCH6), a phenotype characterized by early (often intractable) seizures, profound developmental delay, and progressive pontocerebellar atrophy.",https://openi.nlm.nih.gov/imgs/150/222/4864753/PMC4864753_EPI-57-e97-g001.png
image0018.png,"MRI, MR","F2: MRI brain scan performed mid-treatment. The MRI brain scan performed shortly after readmission with acute neurological symptoms, demonstrates a number of ring-enhancing lesions with surrounding oedema which were thought likely to be metastases.","Bottom Line:Cisplatin based combination chemotherapy produced an initial normalisation of the hCG level, but later in treatment the patient developed new cerebral lesions and a rising serum hCG suggestive of disease progression.Further investigations suggested that the CNS lesions were cerebral TB and that the low levels of hCG elevations was likely to be pituitary in origin.In the treatment of cancer patients it may be helpful to consider the potential non-malignant causes of new CNS lesions and that low hCG elevations may result from physiology rather than pathology in selected cases.",https://openi.nlm.nih.gov/imgs/150/352/2909206/PMC2909206_1471-2407-10-338-2.png
image0019.png,"CT, MRI, MR",f0004: MRI brain scan in variant CJD. FLAIR axial section at the level of the basal ganglia showing bilateral symmetrical dorsomedial and pulvinar thalamic hyperintensity. Courtesy of Dr David Summers.,"Bottom Line:To date there have been 177 case reports in the UK and a further 51 cases worldwide in 11 different countries.Following evidence of blood transfusion as a route of transmission, we have ascertained that all blood components and leucoreduced blood in a sheep model of vCJD have the ability to transmit disease.This, along with the recent appendix survey which identified 16 positive appendices in a study of 32,441 cases, underlines the importance of continued CJD surveillance and maintaining control measures already in place to protect human health.",https://openi.nlm.nih.gov/imgs/150/141/4601215/PMC4601215_kprn-08-04-971581-g004.png
image0020.png,"CT, Tomography","f2-dhps-8-009: The CT brain scan showed global brain swelling causing transcalvarial brain herniation (A).Abbreviation: CT, computed tomography.","Bottom Line:The serum IgE level was very high (734 IU/mL).Single-dose administration of cefazolin for surgical prophylaxis may lead to rare, fatal adverse reaction.The warning signs are sudden, unexplained metabolic acidosis, hypertensive crisis, tachycardia, and facial angioedema predominating with or without cutaneous symptoms like urticaria.",https://openi.nlm.nih.gov/imgs/150/232/4755691/PMC4755691_dhps-8-009Fig2.png
image0021.png,CT,"pone-0098391-g005: MWF maps of healthy 3D T2prep adiabatic spiral brain scan acquired at 1.5T.Two axial slices of MWF computed from the second healthy in vivo 3D T2prep adiabatic spiral brain scan acquired at 1.5T, with conventional reconstruction (top), spatial constrained reconstruction (middle) and anatomical T2 weighted images (bottom).","Bottom Line:Due to efficient design, the additional spatial aspect does not cause an increase in processing time.The proposed method was applied to fast spiral acquisitions on which conventional fitting gives uninterpretable results.While these fast acquisitions suffer from noise and inhomogeneity artifacts, our preliminary results indicate the potential of spatially constrained 3-pool T2 relaxometry.",https://openi.nlm.nih.gov/imgs/150/375/4045663/PMC4045663_pone.0098391.g005.png
image0022.png,"CT, Tomography","f02: (A) Patient 2 nuclear magnetic dopaminergic brain scan: subtle left tracer uptake reduction in the putamen. (B) Patient 2 fludeoxyglucose positron emission tomography and computed tomography: reduced metabolic activity in the bilateral insula, perisylvian regions and midline pre-frontal cortex.",No bottom line,https://openi.nlm.nih.gov/imgs/150/40/5409931/PMC5409931_tre-07-455-7522-1-g002.png
image0023.png,CT,F1: Pre-HBOT SPECT brain scan three dimensional surface reconstruction and processed transverse images. Note bilateral orbital frontal and temporal lobe defects and diffuse heterogeneous pattern of blood flow.,"Bottom Line:The patient experienced a permanent marked improvement in his post-concussive symptoms, physical exam findings, and brain blood flow.In addition, he experienced a complete resolution of post-traumatic stress disorder symptoms.After treatment he became and has remained employed for eight consecutive months.",https://openi.nlm.nih.gov/imgs/150/21/2740054/PMC2740054_1757-1626-0002-0000006538-1.png
image0024.png,"CT, PET","f1-etm-08-04-1167: Selected images of the 18F-FDG PET brain scans. (A–D) Prior to treatment with high-dose corticosteroids and plasmapheresis, the scans revealed generalized hypometabolism without significant hypermetabolic foci. A significant asymmetrical reduction in the metabolism between the left and right hemispheres was noted, particularly in the temporal and parietal cortex. (E–H) The metabolic activities of the former areas were normalized following treatment, with the exception of a slightly lower metabolism in the right temporal cortex when compared with the contralateral site.","Bottom Line:If diagnosed early, the initiation of immunotherapy and removal of the tumor (if present) may result in recovery.The patient demonstrated marked recovery following treatment with a high dose of corticosteroids and plasmapheresis.Accordingly, the follow-up (18)F-FDG PET imaging revealed significant improvement.",https://openi.nlm.nih.gov/imgs/150/116/4151669/PMC4151669_ETM-08-04-1167-g00.png
image0025.png,CT,F2: Post-HBOT SPECT brain scan three dimensional surface reconstruction and processed transverse images. Note relative improvement in brain blood flow to bilateral focal frontal and temporal defects and overall normalization of blood flow to a more homogeneous pattern.,"Bottom Line:The patient experienced a permanent marked improvement in his post-concussive symptoms, physical exam findings, and brain blood flow.In addition, he experienced a complete resolution of post-traumatic stress disorder symptoms.After treatment he became and has remained employed for eight consecutive months.",https://openi.nlm.nih.gov/imgs/150/21/2740054/PMC2740054_1757-1626-0002-0000006538-2.png
image0026.png,"CT, Tomography, Magnetic resonance","F1: (a) A computed tomography brain scan showing bilateral basal ganglia calcification; the cerebellum shows prominent folia indicating mild cerebellar atrophy. (b) Axial T2 brain magnetic resonance image scan showing left temporo-parieto occipital ischemic lesion. (c) Axial T2 brain magnetic resonance image scan showing the extension of the parietal temporal region to the occipital lobe, and also showing a right occipital lesion. (d) Magnetic resonance spectroscopy showing inversion of J-coupling phenomenon at 1.3 ppm, indicating lactate peak.","Bottom Line:Additionally, we screened the polymerase gamma-1 nuclear gene for mutations.Sequencing the full mitochondrial genome did not reveal any known or potentially pathogenic sequence changes.The polymerase gamma-1 gene was also free from mutations.",https://openi.nlm.nih.gov/imgs/150/136/2783076/PMC2783076_1752-1947-3-77-1.png
image0027.png,CT,SHORTS-11-044F1: Non-contrast CT brain scan showing a hyperdense middle cerebral artery,No bottom line,https://openi.nlm.nih.gov/imgs/150/11/3291419/PMC3291419_SHORTS-11-04401.png
image0028.png,"CT, Tomography",F1: Normal non-injected computed tomography brain scan.,"Bottom Line:Dementia is one of the most important neurological disorders in the elderly.Cerebral magnetic resonance imaging (MRI) with gadolinium injection highlighted a diffuse tumor-related infiltration involving both lobes, the putamen, the pallidum, the substantia nigra, and the brainstem, corresponding to the specific description and definition of gliomatosis cerebri.This atypical presentation of a gliomatosis cerebri, and the infiltration of the substantia nigra by the tumor, merits attention.",https://openi.nlm.nih.gov/imgs/150/220/2263063/PMC2263063_1752-1947-2-53-1.png
image0029.png,Magnetic resonance,"Fig1:  Axial magnetic resonance imaging brain scan in patient showing hyperintens lesion in thalami, cerebellum, and pons (arrowed)","Bottom Line:A 4-year-old girl presented with fever, coughing, and vomiting; followed by unconsciousness.Novel influenza A (H1N1) virus was identified by polymerase chain reaction in patient's nasopharyngeal swab specimen.We reported a rare case of clinically severe, novel influenza A-associated encephalitis.",https://openi.nlm.nih.gov/imgs/150/149/3356519/PMC3356519_10072_2011_839_Fig1_HTML.png
image0030.png,"CT, MRI, MR",f2-medscimonit-23-1428: MRI brain scan one month after stent implantation. No brain infarction was observed in MRI images.,No bottom line,https://openi.nlm.nih.gov/imgs/150/385/5374988/PMC5374988_medscimonit-23-1428-g002.png
image0031.png,"CT, MRI, Magnetic resonance, MR","f01: Brain Scans and Imaging.In 2009, a perfusional 99mTc-ECD-SPECT brain scan of the patient revealed bilateral hypoperfusion of the visual association cortices (arrows) (A). Brain magnetic resonance imaging revealed hyperintensities of the optical radiations and bilateral parieto-occipital atrophy (B). In 2012, 99mTc-ECD-SPECT revealed an area of perfusional deficit within the post-central right lobule (arrow) (C). MRI revealed atrophy of the post-central parietal lobule (thick arrow) and increased and asymmetric dilatation of the posterior horn of the right lateral ventricle (small arrow) (D).","Bottom Line:We describe a 60-year-old female with simultanagnosia, oculomotor apraxia, and optic ataxia for which she received an initial clinical diagnosis of posterior cortical atrophy.Three years later, she developed Balint's syndrome, Gerstmann's syndrome, left alien hand syndrome, smooth asymmetric (left) rigidity, cortical sensory loss, and spontaneous myoclonic jerks of the left arm, which suggested a final diagnosis of corticobasal syndrome.This case report indicates that corticobasal syndrome may present with visuospatial deficits.",https://openi.nlm.nih.gov/imgs/150/63/4069812/PMC4069812_tre-04-244-5629-1-g001.png
image0032.png,Unknown,"F1: A well-defined, curvilinear T1 (A) and T2 (B) hyperintense lesion is seen in the superior part of the cerebellar vermis. It appears hypointense on T1 fat-saturated images (C), suggestive of lipoma. Superior vermian hypoplasia is also evident.",No bottom line,https://openi.nlm.nih.gov/imgs/150/186/3895901/PMC3895901_ijms-39-77-g001.png
